{
  "$schema": "http://json-schema.org/draft-07/schema#",
  "title": "Artifact Manifest",
  "type": "object",
  "properties": {
    "artifact_id": { "type": "string" },
    "artifact_type": { "type": "string" },
    "created_at": { "type": "string" },
    "owner": { "type": "string" },
    "source": { "type": "string" },
    "status": { "type": "string" },
    "related_task_id": { "type": "string" },
    "source_file": { "type": "string" },
    "storage_path": { "type": "string" },
    "checksum": { "type": "string" },
    "notes": { "type": "string" }
  },
  "required": ["artifact_id", "artifact_type", "created_at", "owner", "status", "related_task_id"]
}