{
  "artifact_id": "DR-006",
  "artifact_type": "research_report",
  "created_at": "2026-05-31",
  "owner": "Point",
  "source": "deep_research",
  "status": "draft",
  "related_task_id": "DR-006",
  "source_file": "deep-research-OpenClaw Cooperative Cockpit Static MVP หลัง GOAL-008.md",
  "storage_path": "artifacts/deep-research/openclaw-deep-research-reports-pack-v0.1/reports/DR-006_POST_GOAL_008_STATIC_MVP_PHASE_2_SCOPE_GATE.md",
  "checksum": "sha256:01c1fb15277d4c44faa5e7282c0aa19c760c3ee0aff6f90109f6fd2ea7a8a9a8",
  "notes": "Supplemental imported deep research report. Treat as Phase-2 scope-gate input; not implementation authority without Point review."
}
