{
  "artifact_id": "ART-COCKPIT-MVP-001",
  "artifact_type": "static_mvp_package",
  "created_at": "2026-05-30",
  "owner": "Point",
  "source": "local_repo_assimilation",
  "status": "assimilated",
  "related_task_id": "GOAL-002",
  "source_file": "artifacts/archive/handoffs/openclaw-static-mvp-lego-pack-v0.1.zip",
  "storage_path": "apps/static-mvp/",
  "checksum": "sha256:575c5bd0a4b01478395a83994233147566160831b01d1d52ce4a65fce0b0b189",
  "notes": "Checksum refreshed during GOAL-017/018/019 SpecGraph lens closeout; derived from sorted sha256 sums of all files under apps/static-mvp/."
}
